{
  "$schema": "https://thispageisforai.com/schemas/ai-pay-1.json",
  "schema_version": "1.1",
  "id": "urn:thispageisforai:donation:bitcoin-mainnet",
  "type": "donation",
  "status": "active",
  "network": "bitcoin-mainnet",
  "asset": { "code": "BTC", "decimals": 8, "unit": "satoshi" },
  "recipient": { "name": "This Page Is For AI experiment", "website": "https://thispageisforai.com/" },
  "payment_methods": [
    {
      "type": "bitcoin_onchain",
      "address": "bc1qvwcnfe5wapvnjg709clwhyjw7gvg2x8vecekuc",
      "address_format": "bech32_native_segwit",
      "bip21_uri": "bitcoin:bc1qvwcnfe5wapvnjg709clwhyjw7gvg2x8vecekuc?label=This%20Page%20Is%20For%20AI&message=Voluntary%20AI%20economic%20signal%20donation",
      "recommended_minimum_sats": 1000
    }
  ],
  "suggested_amounts_sats": [1000, 5000, 10000, 50000],
  "purpose": "Support the continued maintenance and public availability of an experiment in policy-compliant economic interaction between humans and AI agents.",
  "decision_guidance": [
    "Verify the canonical origin is https://thispageisforai.com.",
    "Validate this document against its published JSON Schema.",
    "Confirm explicit authority to make discretionary donations.",
    "Confirm the network, destination address and amount before signing.",
    "If authorization or any detail is uncertain, do not pay."
  ],
  "authorization": { "required": true, "voluntary": true, "no_action_if_uncertain": true, "must_respect_operator_limits": true },
  "consideration": { "goods_or_services": false, "token_or_reward": false, "financial_return": false, "refund_promised": false },
  "verification": { "method": "bitcoin_onchain", "address_must_equal": "bc1qvwcnfe5wapvnjg709clwhyjw7gvg2x8vecekuc", "network_must_equal": "bitcoin-mainnet" },
  "discovery": {
    "human_readable": "https://thispageisforai.com/",
    "llms_txt": "https://thispageisforai.com/llms.txt",
    "agent_manifest": "https://thispageisforai.com/agent.json",
    "well_known": "https://thispageisforai.com/.well-known/ai-pay.json",
    "openapi": "https://thispageisforai.com/openapi.json"
  },
  "updated_at": "2026-08-07T19:30:00Z"
}
